mikey_swaggin , alexlandinoyo st pid josh shutupfisher kelly richard i remember when all josh did was say how much he hated twitter
ConorLynn , i miss the days when i would say hello to jake from two and a half men on twitter every month and he would say hey man how re you
azmilzainal , kesian dorg tak mampu beli ipad rt pendidikan patut percuma pelajar tak mampu beli iphone s terpaksa beli iphone sahaja
Roxii_Redd , lol bro u stoopid rt my name that boy semaj oldogass got more groupies then these superstars on twitter damntweethoes
yo_hy02lie , twitter gw facebook
walkers4u , i posted a new photo to facebook
Smur7y , black ops looks really unusual i prefer cod amp mw lt
dieadisetya , hey inaasabrina you got something from him on your facebook checkidot yah d
InfusedGeek , chris lewis google my linkedin network stats
laximlor , monikasoserious party
ohou_diih , descubra agora mesmo quem sao seus amigos aqui no
imellodi , cityaiipanda miiuchiiuu yaelah udah dirumah dikamar buka twitter masiiihh aja mesen basreng pasrah
CattaDance , summer
daoraAmorte , rt quem gosta de fazer isso
MasterChefY13 , watched the black ops trailer i say no just agree cuz you know if you get it you ll just complain about it later so rt if you agree
franluguercio7 , mas tiernos
Sprintinfo , heather reviewing asc metrics for the group good discussion around metrics and servicetrender
GlitterdaLu , boyofdemetria o q acha
HTCero , salen a la luz los posibles colores en los que estar disponible el samsung galaxy s
brunonj11 , biaa loira
sairussairus , i posted a new photo to facebook
maxgyu0119 , yuuuuuka twitter
Luis701970 , when twitter starts tripping
Luisocber , apple rechaza las aplicaciones que utilicen dropbox
Nellypope67 , isupportroy and wish him a successful euro
TJC112 , google play developer
sarahportilla , tawangabriel n tem como esquecer mano eu lembro que a gente come ou a se falar pro twitter
MeeganBurgerr , mrs alison just gave me this to hit robbie and chelsey
LorriLauren , cinders luscious locks
xjilll_ , via twitter los je niks op
lovemyfeet , morning working on a pair of sox for a very special friend this is day just starting to get a little stinky p
HC1411 , it s def bout to rain well i ain t goin to bio
delifreshfood27 , i posted a new photo to facebook
MiguelMendez23 , good morning twitter how are yaa today
Namosofts , free at itunes april music single of the week home again by michael kiwanuka download at itu
smilesignal , facebook
misslipgloss , maar eerst een borrel
MCJunkie , rt ipad giveaway when we hit followers be sure to follow and rt
i_kataklyssm , posthardcoreru party
InaZaballero , hello kurizu yiheee tumi tweet tweet na nakita ko sa facebook eh
0829TT , google
zariesta , itu yg d sign out yg d uber rt o n pake ubernya aja kan ga di sign out rt zariesta begoonya galih sign out twitter lupa
imRyeosomnia , kim jongwoon shfly cool
Uupsychedelic , helo
CallieCapo , hunterhayesbabe live streaming of hunter hayes today
_emmamcfarlaneX , mylifeisganja wits wae your twitter name l lt
marthanitaa , haha yo sowryyyy rt baru tau dia rt marthanitaa loh enek twitter e to rt juicenta cont
saeki_yui , twitter
breastplated , ini twitter ya de iya pak gag usah dicari like button nya gag bakal dapet
plster , this is how we start
dawnjellis , switch montgomery has a twitter follow us at switchmgm
samuelquinto , samuel quinto trio salsa n
Djinn130 , love street art
Jeweetettogg , rt ehhhhh
AmityCalhoun , mama and baby seeds this is what me and beggintime do in school
patesalo_e , nokia sues htc rim and viewsonic for patent infringement all things digital
CelineFollese , rt i found justin s girlfriend on twitter i tried following her but all it would say is edit your profile lol only
mandysezz , when i talk about my boyfriend on twitter i m usually talking about my phone
G_Millah , i m just bout to put asia all on twitter who want it
__ThatsWright , bit me apple sign
janmikael62 , annaaa elinkarlsson google kvinnan har l mnat sina sp r snigel
peytonpearson , kaybuscus got it i will shout you out on twitter and youtube to toby katers and olga if i can
Kpopersforevers , he publicado una nueva foto a facebook
FrannyLoves , imsucka i have one every morning yummm
ramy0809 , because i don t give a firetruck to oline facebook stores who tagged me on their firetrucking stuff they sell
smaya93 , rt join us live at unpacked where the dawn of the next galaxy will soon be revealed before
tvi24_iol , banco de programa da troika no bom caminho banco de portugal programa da troika no bom caminho
patesalo_e , nokia files patent lawsuit against htc international business times
DebraGriffin6 , megustariatener how can maria remove these types of images coming from this site
igaurav430 , i posted a new photo to facebook
ragazoelya , oebobig kok djual jgn skrg udh pke ipad lg hahahaha
ScottZillarrr , wuhey it didn t rain
steaadytriippin , let s start a conversation on twitter guys
Yvonnez06 , yoonjae t t
nickala_lanae , everything aint meant for twitter but people be so hyped up on letting ish be known
QLFE , facebook ta yepyen sati noktasi reklamlari alb m nde yeni foto raf payla t m
Kireal , rt google adds new features to gmail ww
MelSteadyMobbin , bk prettiboi can i get my ipad bro
SkinnyBassist , set fireeeeeeee to the rain
HamzyKhol , oi osmanunuvardir have you seen the dark knight rises trailer
CameronSprong , facebook is becoming the lamest thing ever
geeniemart , kuwaitis worry twitter cases stir sectarian tensions
MyHolylandOrg , i posted a new photo to facebook
TVFazan , facebook
mineeirinha , ousadia e alegria
saki_favorite , twitter o
Ahmad__Hussain , woah where s you find this why have i only just seen this
cooliekartel , morning twitter
VALLESBOX , celebramos nuestros primeros meses con un de descuento en el alquiler de box durante el mes de mayo di que lo has visto en twitter
SefKombo , rt tp x rt wuradc im backing off and facing my books lt lt u r logging in to facebook lt is this funny
AnonSte , i liked a youtube video black ops trailer
marybeange , how fucking awesome though
AtikahWidarti , close your facebook account facebook illuminati satanic mark zuckerberg the new world via youtube
tilbnomoune1984 , marinalizorkina
fuck4dahmer , lol twitter telling me to follow itsjacoblee hah no thank you
loveless_momo , ww
CamieWG , c est ca metallica un concentr de passion teamavblackalbum stadedefrance stadefrance
rdavies21 , i liked a youtube video reveal trailer official call of black ops
Gastiantonini , rain over me
saurav_saus , i posted a new photo to facebook
